{
  "brand": "Can-Fan",
  "series": "ISO-Max",
  "model": "ISO-Max 315",
  "status": "active",
  "fan_role": "both",
  "fan_type": "inline_mixed_flow",
  "motor_type": "EC",
  "flange_diameter_mm": 315,
  "max_airflow_m3_h": 2380,
  "recommended_airflow_m3_h": null,
  "static_pressure_pa": null,
  "noise_db_min": null,
  "noise_db_max": 30,
  "power_watts_min": null,
  "power_watts_max": 280,
  "speed_control_type": "transformer_step",
  "controller_included": false,
  "app_control": false,
  "wifi": false,
  "bluetooth": false,
  "length_mm": null,
  "diameter_mm": null,
  "weight_kg": 12.1,
  "source_url": "https://www.ledgrowshop.eu/can-fans/can-fan-iso-max-2380-m3-h-315-mm--odhlucneny-/",
  "source_type": "retailer",
  "source_date": "2026-06-27",
  "confidence_level": "B",
  "uvp_amount": null,
  "uvp_currency": "EUR",
  "notes": "Can-Fan ISO-Max 315 silenced (2380 m3/h): 280W, 1.7A, 230V, 30dB, 12.1kg. Motor type unconfirmed (input claims EC). 3-step switch on some variants. ledgrowshop.eu"
}