{
  "brand": "Systemair",
  "series": "RVK sileo",
  "model": "RVK 160E2-L sileo",
  "status": "active",
  "fan_role": "both",
  "fan_type": "inline_centrifugal",
  "motor_type": "AC",
  "flange_diameter_mm": 160,
  "max_airflow_m3_h": 731,
  "recommended_airflow_m3_h": null,
  "static_pressure_pa": null,
  "noise_db_min": null,
  "noise_db_max": 44.4,
  "power_watts_min": null,
  "power_watts_max": 106,
  "speed_control_type": "external_stepless_controller",
  "controller_included": false,
  "app_control": false,
  "wifi": false,
  "bluetooth": false,
  "length_mm": null,
  "diameter_mm": null,
  "weight_kg": 3.2,
  "source_url": "https://growandstyle.de/systemair-rohrventilator-rvk-silio-160e2-l-731m3-h.html",
  "source_type": "retailer",
  "source_date": "2026-06-27",
  "confidence_level": "B",
  "uvp_amount": 132.5,
  "uvp_currency": "EUR",
  "notes": "RVK 160E2-L: 731 m3/h, 106W, 0.461A, 2557rpm, 44.4dB(A)@3m, ~3.2kg, 160mm, IP44, PP+30% glassfiber. growandstyle.de"
}