{
  "brand": "Spider Farmer",
  "series": "Smart Inline Fan",
  "model": "Smart Inline Fan Starter Kit 4 inch (100mm)",
  "status": "active",
  "fan_role": "both",
  "fan_type": "inline_mixed_flow",
  "motor_type": "EC",
  "flange_diameter_mm": 100,
  "max_airflow_m3_h": 348,
  "recommended_airflow_m3_h": null,
  "static_pressure_pa": null,
  "noise_db_min": null,
  "noise_db_max": 26.8,
  "power_watts_min": null,
  "power_watts_max": 27,
  "speed_control_type": "smart_app_controller",
  "controller_included": true,
  "app_control": true,
  "wifi": true,
  "bluetooth": null,
  "length_mm": null,
  "diameter_mm": null,
  "weight_kg": null,
  "source_url": "https://www.spider-farmer.com/products/spider-farmer-smart-inline-fan-starter-kit-4-inline-fan/",
  "source_type": "manufacturer",
  "source_date": "2026-06-27",
  "confidence_level": "B",
  "uvp_amount": null,
  "uvp_currency": null,
  "notes": "Kit=100mm 4in fan (205CFM=348m3/h,27W,26.8dB,EC,IP42)+1875W 15A smart plug controller for app/climate control. No matching amazon.de kit listing found. spider-farmer.com"
}