{
  "brand": "Blauberg",
  "series": "Turbo EC",
  "model": "Turbo EC 100",
  "status": "active",
  "fan_role": "both",
  "fan_type": "inline_mixed_flow",
  "motor_type": "EC",
  "flange_diameter_mm": 100,
  "max_airflow_m3_h": 300,
  "recommended_airflow_m3_h": null,
  "static_pressure_pa": null,
  "noise_db_min": null,
  "noise_db_max": 47,
  "power_watts_min": null,
  "power_watts_max": 30,
  "speed_control_type": "external_stepless_controller",
  "controller_included": false,
  "app_control": false,
  "wifi": false,
  "bluetooth": false,
  "length_mm": 302.5,
  "diameter_mm": 98,
  "weight_kg": 1.75,
  "source_url": "https://blaubergventilatoren.net/product/turbo-ec-100/",
  "source_type": "manufacturer",
  "source_date": "2026-06-27",
  "confidence_level": "A",
  "uvp_amount": 392.7,
  "uvp_currency": "EUR",
  "notes": "Mfr verified: EC mixed-flow 300 m3/h, 30W, 0.29A, 3680rpm, 47dB@3m, OD98mm, IPX4. Speed via ext 0-10V regulator (CDT E). UVP ~392.70 EUR (retail 235-403). No confirmed amazon listing."
}