{
  "brand": "Prima Klima",
  "series": "PK160 (AC)",
  "model": "PK160-A",
  "status": "active",
  "fan_role": "both",
  "fan_type": "inline_centrifugal",
  "motor_type": "AC",
  "flange_diameter_mm": 160,
  "max_airflow_m3_h": 680,
  "recommended_airflow_m3_h": null,
  "static_pressure_pa": null,
  "noise_db_min": null,
  "noise_db_max": null,
  "power_watts_min": null,
  "power_watts_max": 88,
  "speed_control_type": "none",
  "controller_included": false,
  "app_control": false,
  "wifi": false,
  "bluetooth": false,
  "length_mm": 340,
  "diameter_mm": 232,
  "weight_kg": 2.9,
  "source_url": "https://primaklima.com/shop/ventilation/ac-ventilators/pk160-a/",
  "source_type": "manufacturer",
  "source_date": "2026-06-27",
  "confidence_level": "A",
  "uvp_amount": 116.44,
  "uvp_currency": "EUR",
  "notes": "primaklima.com: ebm-papst AC centrifugal, 680 m3/h, 88W, 230V 0.39A, 2.9kg, 340x232mm. Single-speed A. No confirmed PK160-A amazon.de listing found."
}