{
  "brand": "G-Tools",
  "series": "G-Tools AC tube fan",
  "model": "G-Tools 160 2-speed 800m3",
  "status": "active",
  "fan_role": "both",
  "fan_type": "inline_mixed_flow",
  "motor_type": "AC",
  "flange_diameter_mm": 160,
  "max_airflow_m3_h": 800,
  "recommended_airflow_m3_h": null,
  "static_pressure_pa": null,
  "noise_db_min": null,
  "noise_db_max": null,
  "power_watts_min": 65,
  "power_watts_max": 100,
  "speed_control_type": null,
  "controller_included": false,
  "app_control": false,
  "wifi": false,
  "bluetooth": false,
  "length_mm": null,
  "diameter_mm": null,
  "weight_kg": 6,
  "source_url": "https://www.g-tools.nl/en/product/ventilation/extractor-fan/2-speed-extractor-fan/",
  "source_type": "manufacturer",
  "source_date": "2026-06-27",
  "confidence_level": "A",
  "uvp_amount": 122.95,
  "uvp_currency": "EUR",
  "notes": "g-tools.nl: pos1 400 / pos2 800 m3/h, 65-100W, 0.46A, EBM Pabst motor, 6kg, EUR122.95. 2-speed via dual windings. No Amazon.de listing found."
}