{
  "brand": "Secret Jardin",
  "series": "DF16 Extractor",
  "model": "DF16E350 Extractor T° (150/250/350 m³/h)",
  "status": "active",
  "fan_role": "extraction",
  "fan_type": null,
  "motor_type": "EC",
  "flange_diameter_mm": 150,
  "max_airflow_m3_h": 350,
  "recommended_airflow_m3_h": null,
  "static_pressure_pa": null,
  "noise_db_min": 36,
  "noise_db_max": null,
  "power_watts_min": null,
  "power_watts_max": 35,
  "speed_control_type": "integrated_thermostat",
  "controller_included": true,
  "app_control": false,
  "wifi": false,
  "bluetooth": false,
  "length_mm": null,
  "diameter_mm": null,
  "weight_kg": 1.5,
  "source_url": "https://www.secretjardin.com/wp-content/uploads/2022/09/20220620-EXTRACTORS-FILTERS-DATASHEET.pdf",
  "source_type": "manufacturer_pdf",
  "source_date": "2026-06-27",
  "confidence_level": "A",
  "uvp_amount": 149.9,
  "uvp_currency": "EUR",
  "notes": "3-stage 150/250/350 m3/h, 24Vdc EC 35W (1.5A), 36dB at 150m3/h, 1.5kg, 25x25x21cm, T-control+2 sensors, DF16 click flange. PDF datasheet; price growland.net"
}