{
  "brand": "Ruck",
  "series": "ETAMASTER EM (EC)",
  "model": "EM 250 EC",
  "status": "active",
  "fan_role": "both",
  "fan_type": "inline_mixed_flow",
  "motor_type": "EC",
  "flange_diameter_mm": 250,
  "max_airflow_m3_h": 1780,
  "recommended_airflow_m3_h": null,
  "static_pressure_pa": 510,
  "noise_db_min": null,
  "noise_db_max": null,
  "power_watts_min": null,
  "power_watts_max": 179,
  "speed_control_type": "external_stepless_controller",
  "controller_included": true,
  "app_control": false,
  "wifi": false,
  "bluetooth": false,
  "length_mm": null,
  "diameter_mm": null,
  "weight_kg": 5.7,
  "source_url": "https://www.ventilationland.co.uk/en_GB/p/ruck-r-etamaster-inline-tube-fan-with-ec-motor-1780m3-h-o-250-mm-operation-potentiometer-10-ko/5130/",
  "source_type": "retailer",
  "source_date": "2026-06-27",
  "confidence_level": "B",
  "uvp_amount": 705.78,
  "uvp_currency": "GBP",
  "notes": "EM 250 EC 01. 1780 m3/h (confirmed felderer.de), 510 Pa, 179W, 230V, 3110 rpm, 0-10V pot incl. UVP is UK RRP; no EUR UVP found. ventilationland.co.uk"
}