{
  "brand": "Can-Fan",
  "series": "Max-Fan Pro Series",
  "model": "Max-Fan Pro Series EC 250",
  "status": "active",
  "fan_role": "both",
  "fan_type": "inline_mixed_flow",
  "motor_type": "EC",
  "flange_diameter_mm": 250,
  "max_airflow_m3_h": 2175,
  "recommended_airflow_m3_h": null,
  "static_pressure_pa": null,
  "noise_db_min": null,
  "noise_db_max": 87,
  "power_watts_min": null,
  "power_watts_max": 299,
  "speed_control_type": "external_stepless_controller",
  "controller_included": false,
  "app_control": false,
  "wifi": false,
  "bluetooth": false,
  "length_mm": 215,
  "diameter_mm": null,
  "weight_kg": 4.1,
  "source_url": "https://www.growandstyle.de/can-fan-max-fan-pro-ec-250-2175-m3-h.html",
  "source_type": "retailer",
  "source_date": "2026-06-27",
  "confidence_level": "B",
  "uvp_amount": null,
  "uvp_currency": null,
  "notes": "EC mixed-flow, 2175 m3/h, 299W, 230V/2.0A, 87 dB(A), 4.1 kg, length ~21.5 cm. 0-10V control via Can-Fan EC controller (separate). Source growandstyle.de/gb-hl.de."
}