{
  "brand": "Systemair",
  "series": "K EC sileo",
  "model": "K 100 EC sileo",
  "status": "active",
  "fan_role": "both",
  "fan_type": "inline_centrifugal",
  "motor_type": "EC",
  "flange_diameter_mm": 100,
  "max_airflow_m3_h": 321,
  "recommended_airflow_m3_h": null,
  "static_pressure_pa": null,
  "noise_db_min": null,
  "noise_db_max": 49.8,
  "power_watts_min": null,
  "power_watts_max": 82.6,
  "speed_control_type": "external_stepless_controller",
  "controller_included": true,
  "app_control": false,
  "wifi": false,
  "bluetooth": false,
  "length_mm": null,
  "diameter_mm": null,
  "weight_kg": 2.9,
  "source_url": "https://intelmann.net/en/16955",
  "source_type": "retailer",
  "source_date": "2026-06-27",
  "confidence_level": "B",
  "uvp_amount": 249,
  "uvp_currency": "EUR",
  "notes": "EC ext-rotor centrifugal, galvanized steel; 82.6W, 0.69A, 3479rpm, 49.8dB@3m, max 60C; 0-10V control, pre-wired potentiometer included. intelmann.net/aktivluft.de"
}