{
  "brand": "AC Infinity",
  "series": "CLOUDLINE S-Series",
  "model": "CLOUDLINE S10",
  "status": "active",
  "fan_role": "both",
  "fan_type": "inline_mixed_flow",
  "motor_type": "EC",
  "flange_diameter_mm": 250,
  "max_airflow_m3_h": 2040,
  "recommended_airflow_m3_h": null,
  "static_pressure_pa": 1059,
  "noise_db_min": null,
  "noise_db_max": 48,
  "power_watts_min": null,
  "power_watts_max": 255,
  "speed_control_type": "external_stepless_controller",
  "controller_included": true,
  "app_control": false,
  "wifi": false,
  "bluetooth": false,
  "length_mm": 386,
  "diameter_mm": null,
  "weight_kg": null,
  "source_url": "https://acinfinity.com/cloudline-s10-quiet-inline-fan-10-with-speed-controller/",
  "source_type": "manufacturer",
  "source_date": "2026-06-27",
  "confidence_level": "A",
  "uvp_amount": null,
  "uvp_currency": "EUR",
  "notes": "Mfr: 1201CFM=2040m3/h, 1059Pa, 48dBA, max255W avg136W, EC PWM, wired 10-speed ctrl, UIS-compat. amazon.de PRO S10. EU retail ~329-369EUR (unconfirmed)."
}