{
  "brand": "Can-Fan",
  "series": "Max-Fan",
  "model": "Max-Fan 200 (8 inch)",
  "status": "active",
  "fan_role": "both",
  "fan_type": "inline_mixed_flow",
  "motor_type": "AC",
  "flange_diameter_mm": 200,
  "max_airflow_m3_h": 1133,
  "recommended_airflow_m3_h": null,
  "static_pressure_pa": null,
  "noise_db_min": null,
  "noise_db_max": null,
  "power_watts_min": null,
  "power_watts_max": 179,
  "speed_control_type": "external_stepless_controller",
  "controller_included": false,
  "app_control": false,
  "wifi": false,
  "bluetooth": false,
  "length_mm": null,
  "diameter_mm": null,
  "weight_kg": null,
  "source_url": "https://canfilters.com/products/fans/max-fan/",
  "source_type": "manufacturer",
  "source_date": "2026-06-27",
  "confidence_level": "B",
  "uvp_amount": null,
  "uvp_currency": null,
  "notes": "US 8in spec: 667 CFM (=1133 m3/h), 179W, 3250 rpm (canfilters.com). HO variant exists. EU market now mostly Pro AC 1218 m3/h. Could not confirm EU original-Max-Fan price."
}