{
  "brand": "VENTS",
  "series": "TT PRO",
  "model": "TT PRO 250",
  "status": "active",
  "fan_role": "both",
  "fan_type": "inline_mixed_flow",
  "motor_type": "AC",
  "flange_diameter_mm": 250,
  "max_airflow_m3_h": 1400,
  "recommended_airflow_m3_h": null,
  "static_pressure_pa": null,
  "noise_db_min": 44,
  "noise_db_max": 51,
  "power_watts_min": 125,
  "power_watts_max": 177,
  "speed_control_type": "on_fan_dial",
  "controller_included": false,
  "app_control": false,
  "wifi": false,
  "bluetooth": false,
  "length_mm": 383,
  "diameter_mm": 247,
  "weight_kg": 7.8,
  "source_url": "https://ventilation-system.com/product/tt-pro-250/",
  "source_type": "manufacturer",
  "source_date": "2026-06-27",
  "confidence_level": "A",
  "uvp_amount": null,
  "uvp_currency": null,
  "notes": "AC mixed-flow, 2-speed 1110/1400 m3/h, 247mm casing. Retail (creoven) ~189 EUR for 2-speed variant. ventilation-system.com"
}