{
  "brand": "CarbonActive",
  "series": "CarbonActive EC fan (EC Power Box)",
  "model": "EC Power Box 1000 m³/h",
  "status": "active",
  "fan_role": "both",
  "fan_type": "inline_centrifugal",
  "motor_type": "EC",
  "flange_diameter_mm": 200,
  "max_airflow_m3_h": 1000,
  "recommended_airflow_m3_h": null,
  "static_pressure_pa": 1200,
  "noise_db_min": null,
  "noise_db_max": null,
  "power_watts_min": null,
  "power_watts_max": 170,
  "speed_control_type": "external_stepless_controller",
  "controller_included": false,
  "app_control": false,
  "wifi": false,
  "bluetooth": false,
  "length_mm": null,
  "diameter_mm": null,
  "weight_kg": 7.6,
  "source_url": "https://growxpert.de/Carbon-Active-EC-PowerBox-1000-m-h-O-200mm-1200Pa",
  "source_type": "retailer",
  "source_date": "2026-06-27",
  "confidence_level": "B",
  "uvp_amount": 630.65,
  "uvp_currency": "EUR",
  "notes": "200mm, 1200Pa, 170W/1.4A, 7.6kg, 383x383x368mm. EUR630.65 growxpert; consistent across corpusverde & retailers. ext EC controller req."
}