{
  "brand": "G-Tools",
  "series": "PK EC-THC (Prima Klima OEM, sold via G-Tools)",
  "model": "PK125EC-THC (thermo+hygrostat)",
  "status": "active",
  "fan_role": "both",
  "fan_type": "inline_centrifugal",
  "motor_type": "EC",
  "flange_diameter_mm": 125,
  "max_airflow_m3_h": 680,
  "recommended_airflow_m3_h": null,
  "static_pressure_pa": null,
  "noise_db_min": null,
  "noise_db_max": null,
  "power_watts_min": 0,
  "power_watts_max": 170,
  "speed_control_type": "integrated_thermostat",
  "controller_included": true,
  "app_control": false,
  "wifi": false,
  "bluetooth": false,
  "length_mm": 244,
  "diameter_mm": 244,
  "weight_kg": 2.5,
  "source_url": "https://www.g-tools.nl/en/product/ventilation/extractor-fan/pk125ec-thc-extractor-with-hygrostat-and-thermostat/",
  "source_type": "manufacturer",
  "source_date": "2026-06-27",
  "confidence_level": "A",
  "uvp_amount": 289,
  "uvp_currency": "EUR",
  "notes": "ebm-papst EC. Built-in thermostat + hygrostat (separate knobs), LED min/max indicator. 230V 0.74A, Tmax 50C, 244x244mm, 2.5kg. G-Tools EUR 289 (was 339). No Amazon.de match found."
}