{
  "brand": "RAM",
  "series": "RAM EC Mixed-Flow Inline Fan",
  "model": "RAM EC Mixed-Flow Inline Fan 250mm",
  "status": "active",
  "fan_role": "both",
  "fan_type": "inline_mixed_flow",
  "motor_type": "EC",
  "flange_diameter_mm": 250,
  "max_airflow_m3_h": 1652,
  "recommended_airflow_m3_h": null,
  "static_pressure_pa": null,
  "noise_db_min": null,
  "noise_db_max": null,
  "power_watts_min": null,
  "power_watts_max": null,
  "speed_control_type": "external_stepless_controller",
  "controller_included": true,
  "app_control": false,
  "wifi": false,
  "bluetooth": false,
  "length_mm": null,
  "diameter_mm": null,
  "weight_kg": null,
  "source_url": "https://www.senua-hydroponics.com/products/ram-ec-mixed-flow-inline-fan",
  "source_type": "retailer",
  "source_date": "2026-06-27",
  "confidence_level": "C",
  "uvp_amount": null,
  "uvp_currency": null,
  "notes": "EC variable-speed mixed-flow, 1652m3/h, included remote rotary-dial controller. Power/Pa/dB/RRP not published in sources found."
}