{
  "brand": "Can-Fan",
  "series": "ISO-Max",
  "model": "ISO-Max 200",
  "status": "active",
  "fan_role": "both",
  "fan_type": "inline_mixed_flow",
  "motor_type": "AC",
  "flange_diameter_mm": 200,
  "max_airflow_m3_h": 870,
  "recommended_airflow_m3_h": null,
  "static_pressure_pa": null,
  "noise_db_min": null,
  "noise_db_max": null,
  "power_watts_min": 121,
  "power_watts_max": 130,
  "speed_control_type": "on_fan_dial",
  "controller_included": true,
  "app_control": false,
  "wifi": false,
  "bluetooth": false,
  "length_mm": 600,
  "diameter_mm": null,
  "weight_kg": null,
  "source_url": "https://www.thehydrobros.com/products/iso-max-tube-fan",
  "source_type": "retailer",
  "source_date": "2026-06-27",
  "confidence_level": "B",
  "uvp_amount": 279.9,
  "uvp_currency": "EUR",
  "notes": "ISO-Max 200 (8in): diagonal silenced fan, 3-speed switch (~470/690/870 m3/h max 870), 0.5A, 121-130W, 600mm long. Sources show AC motor w/ integrated 3-speed switch, NOT EC. ASIN genuine Can. der-acker/thehydrobros"
}