{
  "brand": "Rhino",
  "series": "Rhino Ultra Silent EC",
  "model": "Rhino Ultra Silent EC 355mm (14\")",
  "status": "active",
  "fan_role": "both",
  "fan_type": "inline_mixed_flow",
  "motor_type": "EC",
  "flange_diameter_mm": 355,
  "max_airflow_m3_h": 4357,
  "recommended_airflow_m3_h": null,
  "static_pressure_pa": null,
  "noise_db_min": null,
  "noise_db_max": null,
  "power_watts_min": null,
  "power_watts_max": 550,
  "speed_control_type": "external_stepless_controller",
  "controller_included": true,
  "app_control": false,
  "wifi": false,
  "bluetooth": false,
  "length_mm": null,
  "diameter_mm": null,
  "weight_kg": null,
  "source_url": "https://hytechydroponics.com/products/rhino-ultra-silent",
  "source_type": "retailer",
  "source_date": "2026-06-27",
  "confidence_level": "B",
  "uvp_amount": null,
  "uvp_currency": null,
  "notes": "14in silenced EC, 4357 m3/h, 550W, 9-pole EC motor, Varispeed 0-100% incl, IPX4. Noise/SP only given for 12in (66dB/677Pa). UK product, not on amazon.de."
}