{
  "brand": "Blauberg",
  "series": "Turbo",
  "model": "Turbo 315",
  "status": "active",
  "fan_role": "both",
  "fan_type": "inline_mixed_flow",
  "motor_type": "AC",
  "flange_diameter_mm": 315,
  "max_airflow_m3_h": 2050,
  "recommended_airflow_m3_h": null,
  "static_pressure_pa": 392,
  "noise_db_min": 41,
  "noise_db_max": 52,
  "power_watts_min": 230,
  "power_watts_max": 320,
  "speed_control_type": "external_stepless_controller",
  "controller_included": false,
  "app_control": false,
  "wifi": false,
  "bluetooth": false,
  "length_mm": 445,
  "diameter_mm": 310,
  "weight_kg": 11.95,
  "source_url": "https://blaubergventilatoren.net/product/turbo-315-1/",
  "source_type": "manufacturer",
  "source_date": "2026-06-27",
  "confidence_level": "A",
  "uvp_amount": 535.5,
  "uvp_currency": "EUR",
  "notes": "Mfr verified: 2-speed AC mixed-flow, 1570/2050 m3/h, 392Pa nominal ext press, OD310mm, IPX4. UVP from lueftungsmarkt.de. No confirmed amazon.de listing."
}