{
  "brand": "Prima Klima",
  "series": "PK125 (AC)",
  "model": "PK125-L",
  "status": "active",
  "fan_role": "both",
  "fan_type": "inline_centrifugal",
  "motor_type": "AC",
  "flange_diameter_mm": 125,
  "max_airflow_m3_h": 360,
  "recommended_airflow_m3_h": null,
  "static_pressure_pa": null,
  "noise_db_min": null,
  "noise_db_max": null,
  "power_watts_min": null,
  "power_watts_max": 52,
  "speed_control_type": "none",
  "controller_included": false,
  "app_control": false,
  "wifi": false,
  "bluetooth": false,
  "length_mm": null,
  "diameter_mm": null,
  "weight_kg": 2.4,
  "source_url": "https://primaklima.com/de/shop/ventilatoren-de/ac-ventilatoren/pk125-l/",
  "source_type": "manufacturer",
  "source_date": "2026-06-27",
  "confidence_level": "A",
  "uvp_amount": 100.02,
  "uvp_currency": "EUR",
  "notes": "primaklima.com: 360 m3/h, 52 W, 230V/0.23A, Tmax 50C, body 244x220mm, ~2.4 kg, single-speed, backward-curved (radial)."
}