{
  "brand": "Can-Fan",
  "series": "ISO-Max",
  "model": "ISO-Max 250+",
  "status": "active",
  "fan_role": "both",
  "fan_type": "inline_mixed_flow",
  "motor_type": "AC",
  "flange_diameter_mm": 250,
  "max_airflow_m3_h": 2310,
  "recommended_airflow_m3_h": null,
  "static_pressure_pa": null,
  "noise_db_min": null,
  "noise_db_max": null,
  "power_watts_min": null,
  "power_watts_max": 273,
  "speed_control_type": "none",
  "controller_included": false,
  "app_control": false,
  "wifi": false,
  "bluetooth": false,
  "length_mm": 680,
  "diameter_mm": null,
  "weight_kg": 13.4,
  "source_url": "https://www.bushplanet.com/Can-Fan-ISO-Max-250-O-250mm-2310-m-h-273W_1",
  "source_type": "retailer",
  "source_date": "2026-06-27",
  "confidence_level": "B",
  "uvp_amount": 539,
  "uvp_currency": "EUR",
  "notes": "ISO-Max 250+ high-output: 2310 m3/h, 1.7A, 273W, 680mm, 13.4kg, thermal switch. Sources show AC (bushplanet notes integrated speed switch; amazon lists 1-stufig). Retail 479-539 EUR. ASIN Weedness-branded Can reseller, same 2310/250. bushplanet"
}