{
  "brand": "Ruck",
  "series": "ETAMASTER EM (EC)",
  "model": "EM 125 EC",
  "status": "active",
  "fan_role": "both",
  "fan_type": "inline_mixed_flow",
  "motor_type": "EC",
  "flange_diameter_mm": 125,
  "max_airflow_m3_h": 220,
  "recommended_airflow_m3_h": null,
  "static_pressure_pa": 180,
  "noise_db_min": null,
  "noise_db_max": null,
  "power_watts_min": null,
  "power_watts_max": 12,
  "speed_control_type": "external_stepless_controller",
  "controller_included": false,
  "app_control": false,
  "wifi": false,
  "bluetooth": false,
  "length_mm": null,
  "diameter_mm": 125,
  "weight_kg": 0.7,
  "source_url": "https://www.ventilationland.co.uk/en_GB/p/ruck-r-inline-tube-fan-etamaster-with-ec-motor-220-m3-h-o-125-mm-pwm-control/5156/",
  "source_type": "retailer",
  "source_date": "2026-06-27",
  "confidence_level": "B",
  "uvp_amount": 158.39,
  "uvp_currency": "GBP",
  "notes": "EM 125 EC 02 (standard short housing). 3760rpm, 0.2A, ~28% stat eff, IE5 EC, ext PWM MTP50 req. Price GBP (ventilationland.co.uk)"
}