{
  "brand": "VIVOSUN",
  "series": "AeroZesh T (mid GrowHub)",
  "model": "AeroZesh T8 8 inch",
  "status": "active",
  "fan_role": "both",
  "fan_type": "inline_mixed_flow",
  "motor_type": "EC",
  "flange_diameter_mm": 200,
  "max_airflow_m3_h": 1414,
  "recommended_airflow_m3_h": null,
  "static_pressure_pa": null,
  "noise_db_min": null,
  "noise_db_max": 45,
  "power_watts_min": null,
  "power_watts_max": null,
  "speed_control_type": "external_stepless_controller",
  "controller_included": true,
  "app_control": false,
  "wifi": false,
  "bluetooth": false,
  "length_mm": null,
  "diameter_mm": null,
  "weight_kg": null,
  "source_url": "https://www.amazon.com/VIVOSUN-Controller-Programmable-PWM-Controlled-Ventilation/dp/B0F2S6ZLRK",
  "source_type": "marketplace",
  "source_date": "2026-06-27",
  "confidence_level": "C",
  "uvp_amount": null,
  "uvp_currency": null,
  "notes": "US-only model; not on vivosun DE or amazon.de. amazon.com: 832CFM(=1414 m3/h), ~45dB, 3250RPM, E12 ctrl. Watts/EUR price unverified. No amazon.de listing found."
}