{
  "brand": "Blauberg",
  "series": "Turbo",
  "model": "Turbo 150",
  "status": "active",
  "fan_role": "both",
  "fan_type": "inline_mixed_flow",
  "motor_type": "AC",
  "flange_diameter_mm": 150,
  "max_airflow_m3_h": 565,
  "recommended_airflow_m3_h": null,
  "static_pressure_pa": null,
  "noise_db_min": 32,
  "noise_db_max": 44,
  "power_watts_min": 42,
  "power_watts_max": 50,
  "speed_control_type": null,
  "controller_included": false,
  "app_control": false,
  "wifi": false,
  "bluetooth": false,
  "length_mm": 289,
  "diameter_mm": null,
  "weight_kg": 2.95,
  "source_url": "https://blaubergventilatoren.net/product/turbo-150-1/",
  "source_type": "manufacturer",
  "source_date": "2026-06-27",
  "confidence_level": "A",
  "uvp_amount": 178.5,
  "uvp_currency": "EUR",
  "notes": "AC mixed-flow 2-speed, 230V, IPX4. Specs blaubergventilatoren.net; UVP 178.50 (lueftungsmarkt.de). Amazon.de only Turbo-150-T timer variant."
}